<?xml version="1.0" encoding="UTF-8" standalone="no"?>
<!DOCTYPE vaction_objects SYSTEM "vacation.dtd">

<vaction_objects>
	
	<accommodation type="cottage">
		<size>
			<rooms>3</rooms>
		</size>
		<description>Ã„ldre hus med modern inredning.</description>
		<address>
			<town>Puddleton</town>
			<country>England</country>
		</address>
		<price currency="GBP">280</price>
	</accommodation>
	
</vaction_objects>